,city,company,salary,summary,title,parsed_salary,hourly_salary,monthly_salary,annual_salary
3644,Chicago,Jobspring Partners,,"Data, Engineer, Scientist, Big Data, Hadoop, Hive, Pig, Spark, Storm, AWS, Cloud, Java, Python, Agile, Startup, Chicago, Full-time....",Data Engineer,90000.0,,,
3645,Chicago,Selby Jennings,,"Equity Research Analyst – Biotech - Chicago, IL Selby Jennings’ client, a boutique asset management firm, is looking to add an Equity Research Analyst who","Equity Research Analyst – Biotech - Chicago, IL",137500.0,,,
3646,Chicago,Penfield Search Partners,,"Oversee or partner in development of data quality assurance checks, ensuring accuracy and consistency of data released for statistical analysis....",Associate Director Statistics Phase I,185000.0,,,
3647,Chicago,Jobspring Partners,,NET Visual Studio big data bigdata analytics distributed computing parallel data scientist Microsoft cloud SAAS C# OOP algorithms data structures design...,Mid-Level C# .NET Software Engineer,90000.0,,,
3648,Chicago,Clinical Management Consultants,,"Manager Health Information Management Data Analysis HIM Job in Chicago IL. Manager Health Information Management, Manager HIM, Manager Coding, Manager Data...",Manager Health Information Management Data Analysis HIM,82329.0,,,
3652,Chicago,Workbridge Associates,,This agile team will create and develop new solutions to help efficiently analyze and interpret massive data streams as the work itself lives in the continuous...,Senior Java Computer Scientist,130000.0,,,
